{
  "schemaVersion": "1.0.0",
  "name": "Shared Shopping List",
  "slug": "shared-shopping-list",
  "description": "Expected manifest for a multi-surface project. Note that integration and offline-sync are both selected, and GATE-PW covers the web surface only \u2014 mobile is verified separately.",
  "projectType": "web-mobile-backend",
  "platforms": [
    "web",
    "ios",
    "android",
    "backend"
  ],
  "capabilities": {
    "web": true,
    "adminPortal": false,
    "mobile": true,
    "desktop": false,
    "backend": true,
    "api": true,
    "database": true,
    "auth": true,
    "authzRoles": false,
    "offline": true,
    "realtime": true,
    "fileUpload": false,
    "notifications": false,
    "backgroundJobs": false,
    "reporting": false,
    "payments": false,
    "i18n": false,
    "multiTenant": false,
    "responsive": true,
    "browserTesting": true,
    "integration": true,
    "existingCodebase": false,
    "deployable": true
  },
  "stack": {
    "web": {
      "technology": "React + Vite",
      "rationale": "shared language with the API",
      "source": "FACTORY_DEFAULT",
      "language": "TypeScript"
    },
    "mobile": {
      "technology": "React Native",
      "rationale": "one codebase for iOS and Android",
      "source": "FACTORY_DEFAULT",
      "language": "TypeScript"
    },
    "backend": {
      "technology": "Node + Fastify",
      "rationale": "websocket support for realtime updates",
      "source": "FACTORY_DEFAULT",
      "language": "TypeScript"
    },
    "database": {
      "technology": "PostgreSQL",
      "rationale": "relational data with sync-friendly timestamps",
      "source": "FACTORY_DEFAULT"
    },
    "testing": {
      "technology": "Vitest + Detox + Playwright MCP",
      "rationale": "unit, device and browser layers",
      "source": "FACTORY_DEFAULT"
    },
    "infrastructure": {
      "technology": "Container host",
      "rationale": "",
      "source": "FACTORY_DEFAULT"
    }
  },
  "commands": {
    "install": "npm install",
    "dev": "npm run dev",
    "build": "npm run build",
    "test": "npm test",
    "lint": "npm run lint",
    "typecheck": "npm run typecheck",
    "migrate": "npm run migrate"
  },
  "paths": {
    "web": "apps/web/",
    "mobile": "apps/mobile/",
    "backend": "apps/api/",
    "database": "db/"
  },
  "selectedAgents": [
    {
      "id": "project-product",
      "template": "product",
      "file": ".claude/agents/project-product.md",
      "reason": "always"
    },
    {
      "id": "project-requirements",
      "template": "requirements",
      "file": ".claude/agents/project-requirements.md",
      "reason": "always"
    },
    {
      "id": "project-planner",
      "template": "planner",
      "file": ".claude/agents/project-planner.md",
      "reason": "always"
    },
    {
      "id": "project-architect",
      "template": "architect",
      "file": ".claude/agents/project-architect.md",
      "reason": "always"
    },
    {
      "id": "project-technology",
      "template": "technology",
      "file": ".claude/agents/project-technology.md",
      "reason": "always"
    },
    {
      "id": "project-designer",
      "template": "designer",
      "file": ".claude/agents/project-designer.md",
      "reason": "web OR mobile OR adminPortal OR desktop"
    },
    {
      "id": "project-database",
      "template": "database",
      "file": ".claude/agents/project-database.md",
      "reason": "database"
    },
    {
      "id": "project-api",
      "template": "api",
      "file": ".claude/agents/project-api.md",
      "reason": "api"
    },
    {
      "id": "project-backend",
      "template": "backend",
      "file": ".claude/agents/project-backend.md",
      "reason": "backend"
    },
    {
      "id": "project-web",
      "template": "web",
      "file": ".claude/agents/project-web.md",
      "reason": "web OR adminPortal"
    },
    {
      "id": "project-mobile",
      "template": "mobile",
      "file": ".claude/agents/project-mobile.md",
      "reason": "mobile"
    },
    {
      "id": "project-integration",
      "template": "integration",
      "file": ".claude/agents/project-integration.md",
      "reason": "integration (derived)"
    },
    {
      "id": "project-offline-sync",
      "template": "offline-sync",
      "file": ".claude/agents/project-offline-sync.md",
      "reason": "offline"
    },
    {
      "id": "project-qa",
      "template": "qa",
      "file": ".claude/agents/project-qa.md",
      "reason": "always"
    },
    {
      "id": "project-playwright",
      "template": "playwright",
      "file": ".claude/agents/project-playwright.md",
      "reason": "browserTesting"
    },
    {
      "id": "project-bug-fixer",
      "template": "bug-fixer",
      "file": ".claude/agents/project-bug-fixer.md",
      "reason": "always"
    },
    {
      "id": "project-regression",
      "template": "regression",
      "file": ".claude/agents/project-regression.md",
      "reason": "always"
    },
    {
      "id": "project-security",
      "template": "security",
      "file": ".claude/agents/project-security.md",
      "reason": "always"
    },
    {
      "id": "project-performance",
      "template": "performance",
      "file": ".claude/agents/project-performance.md",
      "reason": "backend OR web OR mobile OR desktop"
    },
    {
      "id": "project-devops",
      "template": "devops",
      "file": ".claude/agents/project-devops.md",
      "reason": "deployable"
    },
    {
      "id": "project-reviewer",
      "template": "reviewer",
      "file": ".claude/agents/project-reviewer.md",
      "reason": "always"
    },
    {
      "id": "project-release",
      "template": "release",
      "file": ".claude/agents/project-release.md",
      "reason": "always"
    }
  ],
  "rejectedAgents": [],
  "generatedDocuments": [
    {
      "path": "docs/project-overview.md",
      "template": "project-overview.template.md",
      "owner": "project-product",
      "status": "NOT_STARTED"
    },
    {
      "path": "docs/source-analysis.md",
      "template": "source-analysis.template.md",
      "owner": "discovery",
      "status": "NOT_STARTED"
    },
    {
      "path": "docs/PRD.md",
      "template": "PRD.template.md",
      "owner": "project-product",
      "status": "NOT_STARTED"
    },
    {
      "path": "docs/requirements.md",
      "template": "requirements.template.md",
      "owner": "project-requirements",
      "status": "NOT_STARTED"
    },
    {
      "path": "docs/user-stories.md",
      "template": "user-stories.template.md",
      "owner": "project-requirements",
      "status": "NOT_STARTED"
    },
    {
      "path": "docs/acceptance-criteria.md",
      "template": "acceptance-criteria.template.md",
      "owner": "project-requirements",
      "status": "NOT_STARTED"
    },
    {
      "path": "docs/assumptions.md",
      "template": "assumptions.template.md",
      "owner": "project-product",
      "status": "NOT_STARTED"
    },
    {
      "path": "docs/platform-requirements.md",
      "template": "platform-requirements.template.md",
      "owner": "project-architect",
      "status": "NOT_STARTED"
    },
    {
      "path": "docs/technology-stack.md",
      "template": "technology-stack.template.md",
      "owner": "project-technology",
      "status": "NOT_STARTED"
    },
    {
      "path": "docs/architecture.md",
      "template": "architecture.template.md",
      "owner": "project-architect",
      "status": "NOT_STARTED"
    },
    {
      "path": "docs/development-plan.md",
      "template": "development-plan.template.md",
      "owner": "project-planner",
      "status": "NOT_STARTED"
    },
    {
      "path": "docs/development-status.md",
      "template": "development-status.template.md",
      "owner": "project-planner",
      "status": "NOT_STARTED"
    },
    {
      "path": "docs/testing-strategy.md",
      "template": "testing-strategy.template.md",
      "owner": "project-qa",
      "status": "NOT_STARTED"
    },
    {
      "path": "docs/security.md",
      "template": "security.template.md",
      "owner": "project-security",
      "status": "NOT_STARTED"
    },
    {
      "path": "docs/database-schema.md",
      "template": "database-schema.template.md",
      "owner": "project-database",
      "status": "NOT_STARTED"
    },
    {
      "path": "docs/api-contract.md",
      "template": "api-contract.template.md",
      "owner": "project-api",
      "status": "NOT_STARTED"
    },
    {
      "path": "docs/design-system.md",
      "template": "design-system.template.md",
      "owner": "project-designer",
      "status": "NOT_STARTED"
    },
    {
      "path": "docs/offline-sync.md",
      "template": "offline-sync.template.md",
      "owner": "project-offline-sync",
      "status": "NOT_STARTED"
    },
    {
      "path": "docs/deployment.md",
      "template": "deployment.template.md",
      "owner": "project-devops",
      "status": "NOT_STARTED"
    }
  ],
  "skippedDocuments": [],
  "inputs": {
    "descriptionFile": "input/project-description.md",
    "references": []
  },
  "currentPhase": "03-select-agents",
  "status": "IN_PROGRESS",
  "releaseReadiness": "NOT_EVALUATED",
  "mcp": {
    "playwright": "NOT_PROBED"
  },
  "factoryVersion": "1.0.0",
  "createdAt": "2026-01-01T00:00:00Z",
  "updatedAt": "2026-01-01T00:00:00Z",
  "appUrl": "http://localhost:3000",
  "breakpoints": [
    {
      "name": "mobile",
      "width": 390
    },
    {
      "name": "tablet",
      "width": 768
    },
    {
      "name": "desktop",
      "width": 1280
    }
  ]
}
